{
  "schemaVersion": 1,
  "id": "strategic-logistics",
  "description": "Pins buy/sell price adjustment, store overflow, transfer distance/cost and soldier transformation-bonus selection extracted from the reference, checked against the strategic logistics mod.",
  "reference": {
    "kind": "cpp-reference",
    "repository": "oxce-bai",
    "commit": "4df3a5e571a1a4b5e8a46d3161fb2e21a2adba15",
    "buildOptions": {
      "sources": "src/Mod/RuleItem.cpp (getBuyCostAdjusted, getSellCostAdjusted); src/Savegame/Base.cpp (storesOverfull), WeightedOptions.cpp, Soldier.cpp; src/Basescape/TransferItemsState.cpp (getDistance)",
      "probe": "fixtures/reference-probes/savegames/strategic_logistics_probe.cpp",
      "capture": "tools/capture-strategic-logistics-reference.ps1",
      "compiler": "MSVC x64, /std:c++20; method bodies inserted verbatim by the capture script"
    }
  },
  "inputs": [
    { "path": "fixtures/public/mods/strategic-logistics/logistics/Ruleset/logistics.rul", "size": 3352, "sha256": "d6dbc40250e4ea8e9b8c3857bde10ff5d160a061967a91137aad6b55a14b9397" },
    { "path": "fixtures/public/mods/strategic-logistics/logistics/SoldierName/test.nam", "size": 140, "sha256": "327bf8baba548f2c71ac30b6c01f768b424c2c31681a89f64d850c60a76b4e2a" },
    { "path": "fixtures/public/mods/strategic-logistics/logistics/metadata.yml", "size": 93, "sha256": "96541ca5d20767174f5c1dea04d5e42a6cb9f5d8a3ba9b4344def2e37026f478" },
    { "path": "fixtures/reference-probes/savegames/strategic_logistics_probe.cpp", "size": 4679, "sha256": "bc0892d730f75293d4eb2f170eac80f84713a697a8ca45089e03731fbc4a246f" },
    { "path": "tools/capture-strategic-logistics-reference.ps1", "size": 3467, "sha256": "99d265248c0fce4d8011f9b28082436c9f7739fc92a4e4b82e03f48cf15a7642" }
  ],
  "normalization": ["compact-json"],
  "expected": "fixtures/expected/savegames/strategic-logistics.expected.json"
}
