{
  "schemaVersion": 1,
  "id": "yaml-reference-semantics",
  "description": "Compares multi-document parsing, aliases and merge keys, duplicate lookup, and explicit null detection.",
  "reference": {
    "kind": "cpp-reference",
    "repository": "oxce-bai",
    "commit": "4df3a5e571a1a4b5e8a46d3161fb2e21a2adba15",
    "buildOptions": {
      "architecture": "x64",
      "compiler": "MSVC 19.51",
      "probe": "yaml-semantics-v1"
    }
  },
  "inputs": [
    {
      "path": "fixtures/public/yaml/reference-semantics.yml",
      "size": 302,
      "sha256": "bc804007d2ac32d1521410cf19f75e5185bc38901ed7848bd6d4d3aac24113dd"
    },
    {
      "path": "fixtures/reference-probes/yaml/yaml_probe.cpp",
      "size": 3601,
      "sha256": "203980a1129a6456f92d0b49caba3318aeca7befeb0bac352931f8458c9470e3"
    }
  ],
  "normalization": ["canonical-json-v1"],
  "expected": "fixtures/expected/yaml/reference-semantics.expected.json"
}
