{
  "schemaVersion": 1,
  "id": "strategic-retaliation-target",
  "description": "Retaliation/instant/site-wave base targeting in saved order; discovered flags, multi targets and skip-scouting selection.",
  "reference": {
    "kind": "cpp-reference",
    "repository": "oxce-bai",
    "commit": "4df3a5e571a1a4b5e8a46d3161fb2e21a2adba15",
    "buildOptions": {
      "sources": "Verbatim AlienMission::selectXcomBase; controlled skip-scouting prefix from spawnUfo; uniform minimum choice",
      "capture": "tools/capture-strategic-retaliation-target-reference.ps1",
      "compiler": "MSVC x64 /std:c++20"
    }
  },
  "inputs": [
    {
      "path": "fixtures/reference-probes/savegames/strategic_retaliation_target_probe.cpp",
      "size": 1494,
      "sha256": "b54840f1f80616b21da2e7f315060350b687933da8073209c96c4ef33f325a6d"
    },
    {
      "path": "tools/capture-strategic-retaliation-target-reference.ps1",
      "size": 2641,
      "sha256": "336ce97c9baed02b765e4a050af7bb9aa03c7449cfbd64df0cddd18f3c504af4"
    }
  ],
  "normalization": [
    "compact-json"
  ],
  "expected": "fixtures/expected/savegames/strategic-retaliation-target.expected.json"
}
