{
  "schemaVersion": 1,
  "id": "strategic-objective-base-spawn",
  "description": "Exact final base-objective search and deployment precedence, dynamic retries, technical containment, weighted and invalid texture tables, fallback suppression. Landing-site flags, current zone, allowed landing and site-conversion precedence.",
  "reference": {
    "kind": "cpp-reference",
    "repository": "oxce-bai",
    "commit": "4df3a5e571a1a4b5e8a46d3161fb2e21a2adba15",
    "buildOptions": {
      "sources": "AlienMission::think OBJECTIVE_BASE block, chooseAlienBaseType and Texture::getRandomDeployment inserted verbatim; landing base condition/payload with controlled accepted-landing and conversion envelope",
      "capture": "tools/capture-strategic-objective-base-spawn-reference.ps1",
      "compiler": "MSVC x64 /std:c++20; controlled geometry and creation collaborators"
    }
  },
  "inputs": [
    {
      "path": "fixtures/reference-probes/savegames/strategic_objective_base_spawn_probe.cpp",
      "size": 5469,
      "sha256": "e3aca34b71e930039d58f96374b68f5fdb8526922ba6d1411aee1b1399b9dafe"
    },
    {
      "path": "tools/capture-strategic-objective-base-spawn-reference.ps1",
      "size": 3238,
      "sha256": "efe34e9a21ed7aa23ee4bd3232679070908c2edc483c47dbceb75447a793cec6"
    },
    {
      "path": "fixtures/public/savegames/strategic-objective-base.rul",
      "size": 793,
      "sha256": "a684c3da27b9bdd25afa44c5317aa7f8f91cb89423cdb5b609a4a43cbe97097e"
    }
  ],
  "normalization": [
    "compact-json"
  ],
  "expected": "fixtures/expected/savegames/strategic-objective-base-spawn.expected.json"
}
