{
  "schemaVersion": 1,
  "id": "indexed-surface-operations",
  "description": "Compares transparent-index preservation, 16-color-block transforms, inversion, standard shading, and replacement-color shading.",
  "reference": {
    "kind": "cpp-reference",
    "repository": "oxce-bai",
    "commit": "4df3a5e571a1a4b5e8a46d3161fb2e21a2adba15",
    "buildOptions": {
      "architecture": "x64",
      "compiler": "MSVC 19.51",
      "probe": "indexed-surface-operations-v1",
      "referenceFiles": "src/Engine/Surface.cpp;src/Engine/Surface.h;src/Engine/ShaderDraw.h"
    }
  },
  "inputs": [
    {
      "path": "fixtures/public/rendering/indexed-operations.hex",
      "size": 33,
      "sha256": "484a5a581abb4e03a87ae40ef74bca156aea9c1b4118fd0bb2ba5fc8844904b7"
    },
    {
      "path": "fixtures/reference-probes/rendering/indexed_operations_probe.cpp",
      "size": 3137,
      "sha256": "d251f965387d6ca7916918033209f6f53f8195fc4391ac0728b8aeb54c3fdbe0"
    }
  ],
  "normalization": ["canonical-json-v1", "indexed-data-as-uppercase-hex"],
  "expected": "fixtures/expected/rendering/indexed-operations.expected.json"
}
