{
  "schemaVersion": 1,
  "id": "strategic-detection-scripts",
  "description": "Exact Base::detect and Craft::detect script caller inputs, default outputs, hyperwave and final roll ordering, range boundaries and output substitution.",
  "reference": {
    "kind": "cpp-reference",
    "repository": "oxce-bai",
    "commit": "4df3a5e571a1a4b5e8a46d3161fb2e21a2adba15",
    "buildOptions": {
      "sources": "src/Savegame/Base.cpp (detect), Craft.cpp (detect), Ufo.cpp (DetectUfoFromBaseParser, DetectUfoFromCraftParser); Ufo.cpp getters (damage, shield/percentage, detected/hyperDetected, hunting/escort/mode/behavior); Engine/Script.cpp (ScriptValuesBase::setBase/getBase); SavedGame.cpp (haveReserchVector, isResearched, isResearchedScript), Mod.cpp (getRule/getResearch/getRuleResearch); Ufo.cpp (getDamagePercentage/getDamageMaxScript), Mod.h (isEmptyRuleName); RuleCraft.h (operator+=, addGetStatsScript), RuleUfo/Ufo ScriptRegister; Mod.cpp (getItem/getArmor/getSoldier/getSkill and script wrappers), RuleResearch.h (getNeededItem); ScriptBind.h (BindListInitImpl/BindListLoopImpl), SavedGame.cpp (filterCountryConstScript), Country.cpp/h (pact and current histories); Country.cpp (getRules/ScriptRegister), RuleCountry.cpp (getFundingCap/ScriptRegister); RuleUfo.cpp (getRadius/getWeaponRange/getWeaponPower/getWeaponReload); Mod.h (getMaxViewDistance/getMaxDarknessToSeeUnits), Mod.cpp (constructor/load); RuleCraft.cpp (ScriptRegister, raw Stats prefix); RuleItem.cpp (getWeight/getBattleType/getBattleTypeScript/getTypeScript), Armor.cpp (getSize/getTypeScript), RuleCraft.cpp/RuleSkill.cpp (getTypeScript)",
      "probe": "fixtures/reference-probes/savegames/strategic_detection_scripts_probe.cpp",
      "capture": "tools/capture-strategic-detection-scripts-reference.ps1",
      "compiler": "MSVC x64 /std:c++20; caller methods inserted verbatim, recording Worker stub"
    }
  },
  "inputs": [
    {
      "path": "fixtures/reference-probes/savegames/strategic_detection_scripts_probe.cpp",
      "size": 15768,
      "sha256": "c932a95d83a87e16b44f6adc2d81c7aca8984abb0cbccd73b2c923cc0beb1c6a"
    },
    {
      "path": "tools/capture-strategic-detection-scripts-reference.ps1",
      "size": 9044,
      "sha256": "8724a417ce4b825dc95aa180d8b0db5a3d216b0d2ee0b556ceaf8dee7e49331c"
    },
    {
      "path": "fixtures/public/savegames/strategic-detection-scripts.rul",
      "size": 991,
      "sha256": "e1f91fd8fce1f61b41e0574fa7a1780ad9b83c1388a9743ea6a95bd3bcf72aef"
    },
    {
      "path": "fixtures/public/savegames/strategic-detection-tags.rul",
      "size": 816,
      "sha256": "ac8c56e4cb2d52169fb442ff8574de26a36a5ee324fe8d2e5d466ee449ab0a68"
    }
  ],
  "normalization": [
    "compact-json"
  ],
  "expected": "fixtures/expected/savegames/strategic-detection-scripts.expected.json"
}
