{
  "schemaVersion": 1,
  "id": "runtime-rule-linking",
  "description": "Pins dense strategic runtime projections, typed links, provenance, and starting-base references.",
  "reference": {
    "kind": "cpp-reference",
    "repository": "oxce-bai",
    "commit": "4df3a5e571a1a4b5e8a46d3161fb2e21a2adba15",
    "buildOptions": {
      "sources": "src/Mod/Mod.cpp, RuleCountry.cpp, RuleRegion.cpp, RuleBaseFacility.cpp, RuleCraft.cpp, RuleItem.cpp, RuleSoldier.cpp",
      "probe": "fixtures/reference-probes/rules/runtime_rule_linking_probe.cpp"
    }
  },
  "inputs": [
    { "path": "fixtures/public/mods/runtime-rule-linking/runtime-master/metadata.yml", "size": 106, "sha256": "9c9b4da56a1714b17d6cef5947a1ef98b5f3a2ce127f0584c8292de4f9775953" },
    { "path": "fixtures/public/mods/runtime-rule-linking/runtime-master/Ruleset/rules.rul", "size": 1469, "sha256": "fe96f88d48ffcea2c3c5ae9bc0e3fb100b3a9da1a8290ca3223680f122a352ee" },
    { "path": "fixtures/public/mods/runtime-rule-linking/runtime-addon/metadata.yml", "size": 129, "sha256": "8e38c46d2a2e30c9a96b3b74726541d7ef796b7d280df088becd5a6c123d4f23" },
    { "path": "fixtures/public/mods/runtime-rule-linking/runtime-addon/Ruleset/patch.rul", "size": 253, "sha256": "d2e08ba2397c953aa1169ef72cc8e0a2e6a9bde52b4e21b6c97bfe7de2e37b25" },
    { "path": "fixtures/public/mods/runtime-rule-linking/runtime-addon/Resources/facility.png", "size": 7, "sha256": "dcfe0f5d9a5485501ac880184b0cfabf351ef2e1e4645a735c01b4ee79dda558" },
    { "path": "fixtures/reference-probes/rules/runtime_rule_linking_probe.cpp", "size": 382, "sha256": "4bda7020e382a68facf8bcc3232ce2bcc506780c426be008d9d10f94fc8b3f7a" }
  ],
  "normalization": ["runtime-rule-links-v1", "external-ids", "omit-generation-number", "omit-handle-slots"],
  "expected": "fixtures/expected/mods/runtime-rule-linking.expected.json"
}
