{
  "schemaVersion": 1,
  "id": "strategic-mission-site-candidates",
  "description": "Exact site-command region and area pruning from GeoscapeState::processCommand. Ordered candidates, occupied regions, repeat suppression for points, rectangular texture/site/direct eligibility and invalid or absent zones.",
  "reference": {
    "kind": "cpp-reference",
    "repository": "oxce-bai",
    "commit": "4df3a5e571a1a4b5e8a46d3161fb2e21a2adba15",
    "buildOptions": {
      "sources": "GeoscapeState::processCommand exact site-command block and candidate loop",
      "capture": "tools/capture-strategic-mission-site-candidates-reference.ps1",
      "compiler": "MSVC x64 /std:c++20; loop inserted verbatim"
    }
  },
  "inputs": [
    {
      "path": "fixtures/reference-probes/savegames/strategic_mission_site_candidates_probe.cpp",
      "size": 6664,
      "sha256": "5050878597d92d9a7a7197505b1826aa1bb9c114361665fd1837872e684d402b"
    },
    {
      "path": "tools/capture-strategic-mission-site-candidates-reference.ps1",
      "size": 2831,
      "sha256": "c8ccb2383f4bca9610956754130b3311fdbf56cc9ddce73f7fc7b81ca3d054ac"
    },
    {
      "path": "fixtures/public/savegames/strategic-mission-site-scripts.rul",
      "size": 757,
      "sha256": "7a53f4d3a5caf8eb811caeb923d1a6805b336e3349854de4b3a6453bcf2e0762"
    }
  ],
  "normalization": [
    "compact-json"
  ],
  "expected": "fixtures/expected/savegames/strategic-mission-site-candidates.expected.json"
}
