{
  "schemaVersion": 1,
  "id": "strategic-world-monthly-context",
  "description": "Extracted SavedGame score, funding and maintenance methods plus the GeoscapeState world-script context calculation with controlled campaign data.",
  "reference": {
    "kind": "cpp-reference",
    "repository": "oxce-bai",
    "commit": "4df3a5e571a1a4b5e8a46d3161fb2e21a2adba15",
    "buildOptions": {
      "sources": "SavedGame::getCurrentScore/getCountryFunding/getBaseMaintenance; Mod::getPerformanceBonus; GeoscapeState::determineAlienMissions context block",
      "capture": "tools/capture-strategic-world-monthly-context-reference.ps1",
      "compiler": "MSVC x64 /std:c++20; method and context bodies inserted verbatim"
    }
  },
  "inputs": [
    {
      "path": "fixtures/reference-probes/savegames/strategic_world_monthly_context_probe.cpp",
      "size": 2920,
      "sha256": "187728e5348a4672b4eef15fd61f3d7664609420712dd543beea3a1501d380fa"
    },
    {
      "path": "tools/capture-strategic-world-monthly-context-reference.ps1",
      "size": 3921,
      "sha256": "324b6be44c7d4fddfb36e4a9bfa51b60ee834ba4ca4e52f0612da1329a09a837"
    },
    {
      "path": "fixtures/public/savegames/strategic-world-monthly-context.rul",
      "size": 28,
      "sha256": "c6c9ff115eeac7cdb425a8b42614b0614b07f811a192707fbe0cc9dfb740f05c"
    },
    {
      "path": "fixtures/public/savegames/strategic-world.rul",
      "size": 14290,
      "sha256": "9b1d246a38a20824d282ef0d14a64c65d68e687a780d3caa1f4da8c93a510c07"
    }
  ],
  "normalization": ["compact-json"],
  "expected": "fixtures/expected/savegames/strategic-world-monthly-context.expected.json"
}
