{
  "schemaVersion": 1,
  "id": "indexed-gif",
  "description": "Compares first-frame GIF dimensions, SDL_image palette expansion, pixel indexes, and transparent-index normalization.",
  "reference": {
    "kind": "cpp-reference",
    "repository": "oxce-bai",
    "commit": "4df3a5e571a1a4b5e8a46d3161fb2e21a2adba15",
    "buildOptions": {
      "architecture": "x64",
      "compiler": "MSVC 19.51",
      "probe": "indexed-gif-v1",
      "referenceFiles": "src/Engine/Surface.cpp;src/Engine/Surface.h;deps/include/SDL/SDL_image.h;deps/lib/x64/SDL_image.lib"
    }
  },
  "inputs": [
    {
      "path": "fixtures/public/images/indexed-gif.hex",
      "size": 87,
      "sha256": "55a130d7a901a1b771862e33844cc9870b211a79d4706cff4722a7729159cfee"
    },
    {
      "path": "fixtures/reference-probes/images/indexed_gif_probe.cpp",
      "size": 3008,
      "sha256": "bc8cacf067ba65f2b5c6fefdd5d85e1633f23df1dc52abfc5c4599c7f6fa1720"
    }
  ],
  "normalization": ["canonical-json-v1", "palette-and-indexed-data-as-uppercase-hex"],
  "expected": "fixtures/expected/images/indexed-gif.expected.json"
}
